text	help
Content formats our audience actually consumes	(format + platform + cadence) content-formats-our-audience-actually-consumes
Content marketing topics for our blog	(teach insights from users) content-marketing-topics-for-our-blog
Email marketing sequences to create	(e.g., welcome series) email-marketing-sequences-to-create
Free marketing channels we haven't tried	(channel + first experiment) free-marketing-channels-we-havent-tried
Growth hacks to try this month	(one experiment per week) growth-hacks-to-try-this-month
Guerrilla marketing tactics to try	(unexpected venue + prop) guerrilla-marketing-tactics-to-try
Influencer collaboration ideas	(micro‑creators + authentic tie) influencer-collaboration-ideas
Partnership opportunities to explore	(complementary product + win‑win) partnership-opportunities-to-explore
PR angles for our story	(timely hook + human story) pr-angles-for-our-story
Referral program ideas	(reward both sides) referral-program-ideas
Social media campaigns to run	(theme + challenge + hashtag) social-media-campaigns-to-run
Stories about our origin that people would share	(moment + why it resonates) stories-about-our-origin-that-people-would-share
Types of communities to engage with	(where users already gather) types-of-communities-to-engage-with
Unexpected audiences for our product	(who + why they'd care) unexpected-audiences-for-our-product
Ways to turn customers into evangelists	(delight + shareable moment) ways-to-turn-customers-into-evangelists
