text	tags
ways to encourage kids' creativity	creativity|encouragement|parenting
life skills to teach this month	skills|teaching|growth
positive reinforcement strategies	positive|reinforcement|behavior
conversation starters for kids	conversation|communication|bonding
ways to make chores fun	chores|fun|responsibility
bedtime routine improvements	bedtime|routine|sleep
ways to handle tantrums calmly	tantrums|calm|management
teachable moments to watch for	teaching|moments|learning
ways to build confidence in kids	confidence|building|support
screen time alternatives	screen|alternatives|activities
