text	tags
new family traditions to start	traditions|new|family
holiday traditions to create	holidays|traditions|celebration
birthday celebration ideas	birthday|celebration|special
weekly rituals to establish	weekly|rituals|routine
seasonal activities to make traditional	seasonal|activities|traditions
mealtime traditions	meals|traditions|together
bedtime rituals for connection	bedtime|rituals|bonding
weekend traditions to try	weekend|traditions|family
ways to celebrate achievements	celebration|achievement|recognition
memory-making activities	memories|activities|special
