text	help
business ideas to explore	(target user, problem, and a unique edge)
career goals for the next 5 years	(outcome and the next tiny step)
networking opportunities to pursue	(specifics, a constraint, and one bold example)
side projects to start	(specifics, a constraint, and one bold example)
things I did well this year	(specifics, a constraint, and one bold example)
ways to add value to my team	(specifics, a constraint, and one bold example)
ways to improve my workspace	(specifics, a constraint, and one bold example)
