text	tags
plot twists no one would see coming	twist|surprise|plot
subplots to weave into the main story	subplot|layers|complexity
ways to raise the stakes	stakes|tension|escalation
cliffhanger endings for chapters	cliffhanger|suspense|endings
opening scenes that hook readers	opening|hook|beginning
obstacles to throw at my protagonist	obstacles|conflict|challenges
red herrings to mislead readers	mystery|misdirection|plot
ways to foreshadow the ending	foreshadowing|hints|setup
midpoint reversals to consider	midpoint|reversal|structure
climax scenarios for my story	climax|resolution|ending
